<?xml version="1.0" encoding="UTF-8"?>
<metadata language="fr_FR" xmlns:xsi="http://www.w3.org/2001/XMLSchema-instance" xsi:noNamespaceSchemaLocation="../../language.xsd">
	<string id="idPhysicalBuildLabel1">Corpulence moyenne</string>
	<string id="idPhysicalBuildLabel2">Gros</string>
	<string id="idPhysicalBuildLabel3">Mince</string>
	<string id="idPhysicalBuildLabel4">Haut</string>
	<string id="idPhysicalBuildLabel5">Bas</string>
	<string id="idTextPielBlanca">Peau blanche</string>
	<string id="idTextPielNegra">Peau noire</string>
	<string id="idTextPielAmarillaOscura">Peau jaune foncé</string>
	<string id="idTextPielAmarillaClara">Peau jaune clair</string>
	<string id="idTextPielRoja">Redskin</string>
	<string id="idTextBlancoOjos">Sclérotique</string>
	<string id="idTextOjos">Yeux</string>
	<string id="idTextCejas1">Sourcils minces</string>
	<string id="idTextCejas2">Sourcils gras</string>
	<string id="idTextPestanas">Onglets</string>
	<string id="idTextCamisetaSinMangas">Tee-shirt sans manches</string>
	<string id="idTextCamiseta">Tee-shirt</string>
	<string id="idTextCamisetaTirantes">Tee-shirt de bretelles</string>
	<string id="idTextTop">Top</string>
	<string id="idTextPantalonCorto">Short</string>
	<string id="idTextPantalonLargo">Long pantalon</string>
	<string id="idTextZapatos">Chaussures</string>
	<string id="idTextMedias">Moyennes</string>
	<string id="idTextColorete">Fards à joues</string>
	<string id="idTextSombraOjos">Fard à paupières</string>
	<string id="idTextLabios">Lèvres</string>
	<string id="idTextDientes">Dents</string>
	<string id="idTextLengua">Langue</string>
	<string id="idTextPendientes">Boucles d'oreille</string>
	<string id="idTextTiritaDcha">Droite grelotte</string>
	<string id="idTextTiritaIzq">Gauche grelotte</string>
	<string id="idTextPearcingBarbilla">Piercing dans le menton</string>
	<string id="idTextPearcingDcho">Piercing droit</string>
	<string id="idTextPearcingIzq">Piercing gauche</string>
	<string id="idTextCollar1">Collier</string>
	<string id="idTextCollar2">Collier</string>
	<string id="idTextLazoCuello">Boucle dans le cou</string>
	<string id="idTextMunequeras">Bracelets</string>
	<string id="idTextPulseraDcha">Poignet droit</string>
	<string id="idTextPulseraIzq">Poignet gauche</string>
	<string id="idTextPeloLong">Cheveux longs</string>
	<string id="idTextPeloOld">Vieux cheveux</string>
	<string id="idTextPeloPonyTail">Queue de cheval cheveux</string>
	<string id="idTextPeloShort">Cheveux courts</string>
</metadata>