<?xml version="1.0" encoding="UTF-8"?>
<metadata language="en_UK" xmlns:xsi="http://www.w3.org/2001/XMLSchema-instance" xsi:noNamespaceSchemaLocation="../language.xsd">
	<string id="idNameFamily">Medieval</string>
	<string id="idDescriptionFamily">This family has composed by two humans: a man and a woman. Every human can dress casual or medieval.</string>
	<string id="idAuthor">???</string>
	<!-- Revisar los nombres de los bone controller -->
	<string id="idMultiStageLabel1">Scale</string>
	<string id="idBoneControler1">Head</string>
	<string id="idBoneControler2">Arms</string>
	<string id="idBoneControler3">Hands</string>
	<string id="idBoneControler4">Legs</string>
	<string id="idBoneControler5">Feet</string>
	<string id="idMultiStageLabel2">Skin</string>
	<string id="idTextureSubStageLabel1">Skins</string>
	<string id="idMultiStageLabel3">Hair</string>
	<string id="idTextureSubStageLabel2">Hairs</string>
	<string id="idMultiStageLabel4">Eyes</string>
	<string id="idTextureSubStageLabel3">Eyes</string>
	<string id="idMultiStageLabel5">Clothes</string>
	<string id="idTextureSubStageLabel4">Shirts</string>
	<string id="idTextureSubStageLabel5">Trousers or skirts</string>
	<string id="idMultiStageLabel6">Shoes</string>
	<string id="idTextureSubStageLabel6">Shoes</string>
	<string id="idMultiStageLabel7">Accessories</string>
	<string id="idTextureSubStageLabel7">Accessories</string>
	<string id="idAnimationStageLabel1">Export</string>
	<string id="idQualityLabel1">High</string>
	<string id="idQualityLabel2">Medium</string>
	<string id="idQualityLabel3">Low</string>
	<string id="idCameraLabel1">Front</string>
	<string id="idCameraLabel2">2D</string>
	<string id="idModelLabel1">Man</string>
	<string id="idModelLabel2">Woman</string>
</metadata>