<?xml version="1.0" encoding="UTF-8"?>
<metadata language="es_ES" xmlns:xsi="http://www.w3.org/2001/XMLSchema-instance" xsi:noNamespaceSchemaLocation="../../language.xsd">
	<string id="idPhysicalBuildLabel1">Complexión media</string>
	<string id="idPhysicalBuildLabel2">Gordo</string>
	<string id="idPhysicalBuildLabel3">Delgado</string>
	<string id="idPhysicalBuildLabel4">Alto</string>
	<string id="idPhysicalBuildLabel5">Bajo</string>
	<string id="idTextPielCasual">Piel casual</string>
	<string id="idTextPielMedieval">Piel medieval</string>
	<string id="idTextPeloCasual">Pelo casual</string>
	<string id="idTextPeloMedieval">Pelo medieval</string>
	<string id="idTextOjosCasual">Ojos casual</string>
	<string id="idTextOjosMedieval">Ojos medieval</string>
	<string id="idTextCamisetaCasual">Camiseta casual</string>
	<string id="idTextCamisetaMedieval">Camiseta medieval</string>
	<string id="idTextPantalonCasual">Pantalón casual</string>
	<string id="idTextPantalonMedieval">Pantalón medieval</string>
	<string id="idTextZapatosCasual">Zapatos casual</string>
	<string id="idTextZapatosMedieval">Zapatos medieval</string>
	<string id="idTextGuantes">Guantes</string>
</metadata>