<?xml version="1.0" encoding="UTF-8"?>
<metadata language="en_UK" xmlns:xsi="http://www.w3.org/2001/XMLSchema-instance" xsi:noNamespaceSchemaLocation="../../language.xsd">
	<string id="idPhysicalBuildLabel1">Medium-Built</string>
        <string id="idPhysicalBuildLabel2">Tall</string>
        <string id="idPhysicalBuildLabel3">Small</string>
	<string id="idTextPielCasual">Casual skin</string>
	<string id="idTextPielMedieval">Medieval skin</string>
	<string id="idTextPeloCasual">Casual hair</string>
	<string id="idTextPeloMedieval">Medieval hair</string>
	<string id="idTextOjosCasual">Casual eyes</string>
	<string id="idTextOjosMedieval">Medieval eyes</string>
	<string id="idTextCamisetaCasual">Casual t-shirt</string>
	<string id="idTextCamisetaMedieval">Medieval t-shirt</string>
	<string id="idTextPantalonCasual">Casual trouser</string>
	<string id="idTextPantalonMedieval">Medieval trouser</string>
	<string id="idTextZapatosCasual">Casual shoes</string>
	<string id="idTextZapatosMedieval">Medieval shoes</string>
	<string id="idTextGuantes">Gloves</string>
</metadata>