<?xml version="1.0" encoding="UTF-8"?>
<metadata language="fr_FR" xmlns:xsi="http://www.w3.org/2001/XMLSchema-instance" xsi:noNamespaceSchemaLocation="../language.xsd">
	<string id="idNameFamily">eAdventure</string>
	<string id="idDescriptionFamily">Cette famille est composée par 2 humains: un garçon et une fille.</string>
	<string id="idAuthor">Alex,Sergio et David</string>
	<string id="idMultiStageLabel1">Scalaire</string>
	<string id="idBoneControler1">Torse, Tête et bras</string>
	<string id="idBoneControler2">Tête</string>
	<string id="idBoneControler3">Bras</string>
	<string id="idBoneControler4">Gauche</string>
	<string id="idBoneControler5">Main gauche</string>
	<string id="idBoneControler6">Droit</string>
	<string id="idBoneControler7">Main droit</string>
	<string id="idBoneControler8">Jambes</string>
	<string id="idBoneControler9">Gauche</string>
	<string id="idBoneControler10">Pied gauche</string>
	<string id="idBoneControler11">Droit</string>
	<string id="idBoneControler12">Pied droit</string>
	<string id="idMultiStageLabel2">Peau</string>
	<string id="idTextureSubStageLabel1">Skins</string>
	<string id="idMultiStageLabel3">Yeux</string>
	<string id="idTextureSubStageLabel2">Yeux</string>
	<string id="idTextureSubStageLabel3">Surcils et cils</string>
	<string id="idMultiStageLabel4">T-Shirts</string>
	<string id="idTextureSubStageLabel4">T-Shirts</string>
	<string id="idMultiStageLabel5">Pantalons</string>
	<string id="idTextureSubStageLabel5">Pantalons</string>
	<string id="idMultiStageLabel6">Chaussures</string>
	<string id="idTextureSubStageLabel6">Chaussures</string>
	<string id="idTextureSubStageLabel7">Chaussettes</string>
	<string id="idMultiStageLabel7">Cheveaux</string>
	<string id="idTextureSubStageLabel8">Cheveaux</string>
	<string id="idMultiStageLabel8">Accessories</string>
	<string id="idTextureSubStageLabel9">Visage</string>
	<string id="idTextureSubStageLabel10">Accessories du visage</string>
	<string id="idTextureSubStageLabel11">Autres accessories</string>
	<string id="idAnimationStageLabel1">Exportation</string>
	<string id="idQualityLabel1">Haut</string>
	<string id="idQualityLabel2">Moyenne</string>
	<string id="idQualityLabel3">Bas</string>
	<string id="idCameraLabel1">Frontale</string>
	<string id="idCameraLabel2">2D</string>
	<string id="idModelLabel1">Homme</string>
	<string id="idModelLabel2">Femme</string>
	<string id="idModelLabel3">Garçon</string>
	<string id="idModelLabel4">Fille</string>
</metadata>