<?xml version="1.0" encoding="UTF-8"?>
<metadata language="fr_FR" xmlns:xsi="http://www.w3.org/2001/XMLSchema-instance" xsi:noNamespaceSchemaLocation="language.xsd">
	<string id="language">assets/Locale/Flags/France.png</string>
	<string id="idDescription">Bienvenue au configurateur des personages pour eAdventure. Avec cet configurateur des personages vous pouvez crèer votre avatar pour jouer aux jeux dans la platforme eAdventure.</string>
	<string id="idStart">Démarrer</string>
	<string id="idQuit">Sortir</string>
	<string id="idLanguage">Langue</string>
	<string id="idChoose">Choisi ton modéle</string>
	<string id="idFamily">Choisi la famille:</string>
	<string id="idPrevious">Précédent</string>
	<string id="idNext">Suivant</string>
	<string id="idFinish">Finaliser</string>
	<string id="idColor">Coleur</string>
	<string id="idQuality">Qualité</string>
	<string id="idCamera">Caméra</string>
	<string id="idAnimations">Animations</string>
        <string id="idPreview">Voir</string>
	<string id="idPopup1">Est-ce que vous voulez retoucher le modéle ou contiuner l'exportation?</string>
	<string id="idPopup2">Est-ce que vous voulez créer un nouveau modéle?</string>
	<string id="idPopupButton1">Retoucher</string>
	<string id="idPopupButton2">Exporter</string>
	<string id="idPopupButton3">Oui</string>
	<string id="idPopupButton4">Non</string>
        <string id="idBase">Base</string>
        <string id="idDetails">Détails</string>
	<string id="idRed">Rouge</string>
	<string id="idGreen">Vert</string>
	<string id="idBlue">Bleu</string>
	<string id="idAcept">Accepter</string>
	<string id="idCancel">Annuler</string>
	<string id="idBasic">De base</string>
	<string id="idCustom">Personnalisée</string>
	<string id="idAll">Tous</string>
	<string id="idNothing">Aucun</string>
	<string id="idDescriptionFamily">Description</string>
	<string id="idAuthor">Author</string>
	<string id="idUrl">Url</string>
	<string id="idHeader">Sélectionnez une famille, puis le modèle de base pour commencer</string>
	<string id="idSubHeader">Bienvenue à eCharacter, les caractères de eAdventure configurateur. Pour en savoir plus sur le projet, cliquez</string>
	<string id="idHere">ici</string>
	<string id="idWelcome">Bienvenue</string>
	<string id="ideCharacter">Chaîne caractères configurateur</string>
	<string id="idPopupLanguage">S'il vous plaît choisir la langue que vous préférez utiliser la liste</string>
</metadata>
	