<?xml version="1.0" encoding="UTF-8"?>
<metadata language="es_ES" xmlns:xsi="http://www.w3.org/2001/XMLSchema-instance" xsi:noNamespaceSchemaLocation="./language.xsd">
	<string id="language">assets/Locale/Flags/Spain.png</string>
	<string id="idDescription">Bienvenido al configurador de personajes para eAdventure. Con este configurador de personajes podrás crear tu avatar para jugar a los juegos de la plataforma eAdventure.</string>
	<string id="idStart">Inicio</string>
	<string id="idQuit">Salir</string>
	<string id="idLanguage">Idioma</string>
	<string id="idChoose">Elige tu modelo</string>
	<string id="idFamily">Elige la familia:</string>
	<string id="idPrevious">Anterior</string>
	<string id="idNext">Siguiente</string>
	<string id="idFinish">Finalizar</string>
	<string id="idColor">Color</string>
	<string id="idQuality">Calidad</string>
	<string id="idCamera">Cámara</string>
	<string id="idAnimations">Animaciones</string>
        <string id="idPreview">Ver</string>
	<string id="idPopup1">¿Quiere retocar el modelo o continuar con la exportación?</string>
	<string id="idPopup2">¿Quiere generar un nuevo modelo?</string>
	<string id="idPopupButton1">Retocar</string>
	<string id="idPopupButton2">Exportar</string>
	<string id="idPopupButton3">Si</string>
	<string id="idPopupButton4">No</string>
        <string id="idBase">Base</string>
        <string id="idDetails">Detalles</string>
	<string id="idRed">Rojo</string>
	<string id="idGreen">Verde</string>
	<string id="idBlue">Azul</string>
	<string id="idAcept">Aceptar</string>
	<string id="idCancel">Cancelar</string>
	<string id="idBasic">Basico</string>
	<string id="idCustom">Avanzado</string>
	<string id="idAll">Todas</string>
	<string id="idNothing">Ninguna</string>
	<string id="idDescriptionFamily">Descripción</string>
	<string id="idAuthor">Autor</string>
	<string id="idUrl">Url</string>
	<string id="idHeader">Selecciona una familia y luego el modelo base para comenzar</string>
	<string id="idSubHeader">Bienvenido a eCharacter, el configurador de personajes de eAdventure. Para conocer más detalles sobre el proyecto pulse</string>
	<string id="idHere">aquí</string>
	<string id="idWelcome">Bienvenido a</string>
	<string id="ideCharacter">El configurador de personajes</string>
	<string id="idPopupLanguage">Por favor, seleccione el idioma de la lista que prefiera utilizar</string>
	<string id="idDownload">Descargar</string>
	<string id="idRepoText">Descarga las familias que más te gusten</string>
</metadata>
	